[
  {
    "observation_id": "obs-037-62b51c935360d0670b62",
    "company_id": "tsn",
    "source_id": "ee036-fresh-09-tsn",
    "source_hash": "0cd48e98cf6747eb56060a9e76d9650ee3bb541569e8d5b89e7e3d8b1ff94694",
    "evidence_span": "Prepared Foods segment results for fiscal 2025 included $41 million of charges related to a product recall and a net benefit of $26 million related to restructuring and related charges, which included a gain from the sale of storage facilities net of other plan charges.",
    "evidence_start": 513,
    "evidence_end": 783,
    "subject": "Prepared Foods segment",
    "action_or_state": "recorded",
    "object": "product-recall charges and restructuring-related net benefit",
    "timing": "COMPLETED_RECENT",
    "polarity": "MIXED",
    "scope": "Prepared Foods",
    "entity_relationship": "ISSUER",
    "publication_date": "2025-11-10",
    "effective_date": null,
    "confidence": "HIGH",
    "decision": "ACCEPT",
    "reason_code": "DEVELOPMENT_REPLAY_YES",
    "extractor_version": "evidence-engine-v0.3.7-development",
    "model_version": "ai-finops-review-replay-v1",
    "created_at": "2026-08-19T07:05:38.363946Z"
  },
  {
    "observation_id": "obs-037-91bba16020cd93d285ff",
    "company_id": "tsn",
    "source_id": "ee036-fresh-09-tsn",
    "source_hash": "0cd48e98cf6747eb56060a9e76d9650ee3bb541569e8d5b89e7e3d8b1ff94694",
    "evidence_span": "In fiscal 2025, our operating income was impacted by $738 million of legal contingency accruals, $343 million of goodwill and intangible impairments, $45 million of restructuring and related charges, $41 million of charges related to a product recall and $23 million related to brand and product line discontinuations.",
    "evidence_start": 0,
    "evidence_end": 318,
    "subject": "Issuer",
    "action_or_state": "incurred",
    "object": "restructuring, product-recall and brand/product-line discontinuation charges",
    "timing": "COMPLETED_RECENT",
    "polarity": "NEGATIVE",
    "scope": "fiscal 2025",
    "entity_relationship": "ISSUER",
    "publication_date": "2025-11-10",
    "effective_date": null,
    "confidence": "HIGH",
    "decision": "ACCEPT",
    "reason_code": "DEVELOPMENT_REPLAY_YES",
    "extractor_version": "evidence-engine-v0.3.7-development",
    "model_version": "ai-finops-review-replay-v1",
    "created_at": "2026-08-19T07:05:38.364495Z"
  },
  {
    "observation_id": "obs-037-a73e7017a20299a91655",
    "company_id": "jnj",
    "source_id": "ee036-fresh-01-jnj",
    "source_hash": "082f4e489d4c19f585cae4c8b62acea92bd6727576f7b0e450b9dfe8ecd42694",
    "evidence_span": "Mr. Schmid was appointed Executive Vice President, Worldwide Chairman, MedTech and a member of the Executive Committee in 2023.",
    "evidence_start": 120,
    "evidence_end": 247,
    "subject": "Tim Schmid",
    "action_or_state": "was appointed",
    "object": "Executive Vice President, Worldwide Chairman, MedTech and Executive Committee member",
    "timing": "HISTORICAL",
    "polarity": "NEUTRAL",
    "scope": "MedTech leadership",
    "entity_relationship": "ISSUER",
    "publication_date": "2026-02-11",
    "effective_date": null,
    "confidence": "HIGH",
    "decision": "ACCEPT",
    "reason_code": "DEVELOPMENT_REPLAY_YES",
    "extractor_version": "evidence-engine-v0.3.7-development",
    "model_version": "ai-finops-review-replay-v1",
    "created_at": "2026-08-19T07:05:38.364570Z"
  },
  {
    "observation_id": "obs-037-749b5e397b3d66276b62",
    "company_id": "tsla",
    "source_id": "ee036-fresh-03-tsla",
    "source_hash": "90d5d2bc4057df41c645f85dcebe575af9b0953a6a1902d189297bec17fd440a",
    "evidence_span": "transferable tax credits of up to $ 195 million in consideration of capital investment and hiring targets that were met at Gigafactory Nevada.",
    "evidence_start": 483,
    "evidence_end": 625,
    "subject": "Gigafactory Nevada",
    "action_or_state": "met",
    "object": "capital investment and hiring targets tied to tax incentives",
    "timing": "HISTORICAL",
    "polarity": "POSITIVE",
    "scope": "Gigafactory Nevada",
    "entity_relationship": "ISSUER",
    "publication_date": "2026-01-29",
    "effective_date": null,
    "confidence": "HIGH",
    "decision": "ACCEPT",
    "reason_code": "DEVELOPMENT_REPLAY_YES",
    "extractor_version": "evidence-engine-v0.3.7-development",
    "model_version": "ai-finops-review-replay-v1",
    "created_at": "2026-08-19T07:05:38.364615Z"
  },
  {
    "observation_id": "obs-037-7002655087e9ca4d1c1b",
    "company_id": "tgt",
    "source_id": "ee036-fresh-11-tgt",
    "source_hash": "20bc4552dcb1df7c0bbd837f721de931e2ab4cdd2cb2e3c147f335d41eb68a52",
    "evidence_span": "Business Segment Results (millions) 2025 2024 2023 Net sales $ 104,780 $ 106,566 $ 107,412",
    "evidence_start": 0,
    "evidence_end": 90,
    "subject": "Issuer business segment",
    "action_or_state": "reported",
    "object": "year-over-year changes in sales, costs and operating income",
    "timing": "CURRENT",
    "polarity": "MIXED",
    "scope": "business segment results",
    "entity_relationship": "ISSUER",
    "publication_date": "2026-03-11",
    "effective_date": null,
    "confidence": "MEDIUM",
    "decision": "ACCEPT",
    "reason_code": "DEVELOPMENT_REPLAY_YES",
    "extractor_version": "evidence-engine-v0.3.7-development",
    "model_version": "ai-finops-review-replay-v1",
    "created_at": "2026-08-19T07:05:38.364643Z"
  },
  {
    "observation_id": "obs-037-d4cf83b178d336694fee",
    "company_id": "tsn",
    "source_id": "ee036-fresh-09-tsn",
    "source_hash": "0cd48e98cf6747eb56060a9e76d9650ee3bb541569e8d5b89e7e3d8b1ff94694",
    "evidence_span": "Average sales price increased primarily due to the pass through of increased raw material costs. \u2022 Operating Income \u2013 Operating income increased primarily due to higher average sales price, improved operational execution and lower selling, general and administrative costs",
    "evidence_start": 24,
    "evidence_end": 296,
    "subject": "Issuer segment",
    "action_or_state": "improved",
    "object": "average sales price and operating income",
    "timing": "COMPLETED_RECENT",
    "polarity": "POSITIVE",
    "scope": "fiscal 2025 segment results",
    "entity_relationship": "ISSUER",
    "publication_date": "2025-11-10",
    "effective_date": null,
    "confidence": "HIGH",
    "decision": "ACCEPT",
    "reason_code": "DEVELOPMENT_REPLAY_YES",
    "extractor_version": "evidence-engine-v0.3.7-development",
    "model_version": "ai-finops-review-replay-v1",
    "created_at": "2026-08-19T07:05:38.364670Z"
  },
  {
    "observation_id": "obs-037-0c2bbb13eec153020984",
    "company_id": "amzn",
    "source_id": "ee036-fresh-05-amzn",
    "source_hash": "beb1bfc28558135e76882db0cf36ba72a1ab44e2144fe37534f4da1e120ddb57",
    "evidence_span": "We do not have long-term arrangements with most of our suppliers to guarantee availability of merchandise, content, components, or services, particular payment terms, or the extension of credit limits.",
    "evidence_start": 0,
    "evidence_end": 201,
    "subject": "Issuer",
    "action_or_state": "does not have",
    "object": "long-term arrangements with most suppliers guaranteeing availability or terms",
    "timing": "CURRENT",
    "polarity": "NEUTRAL",
    "scope": "supplier arrangements",
    "entity_relationship": "ISSUER",
    "publication_date": "2026-02-06",
    "effective_date": null,
    "confidence": "HIGH",
    "decision": "ACCEPT",
    "reason_code": "DEVELOPMENT_REPLAY_YES",
    "extractor_version": "evidence-engine-v0.3.7-development",
    "model_version": "ai-finops-review-replay-v1",
    "created_at": "2026-08-19T07:05:38.364690Z"
  },
  {
    "observation_id": "obs-037-24332ec6fad98f43278d",
    "company_id": "jnj",
    "source_id": "ee036-fresh-01-jnj",
    "source_hash": "082f4e489d4c19f585cae4c8b62acea92bd6727576f7b0e450b9dfe8ecd42694",
    "evidence_span": "the Company has robust business continuity plans in place across our global supply chain network designed to help mitigate the impact of health crises",
    "evidence_start": 213,
    "evidence_end": 363,
    "subject": "Issuer",
    "action_or_state": "has",
    "object": "business continuity plans across its global supply chain network",
    "timing": "CURRENT",
    "polarity": "POSITIVE",
    "scope": "global supply chain network",
    "entity_relationship": "ISSUER",
    "publication_date": "2026-02-11",
    "effective_date": null,
    "confidence": "HIGH",
    "decision": "ACCEPT",
    "reason_code": "DEVELOPMENT_REPLAY_YES",
    "extractor_version": "evidence-engine-v0.3.7-development",
    "model_version": "ai-finops-review-replay-v1",
    "created_at": "2026-08-19T07:05:38.364706Z"
  },
  {
    "observation_id": "obs-037-9767f37831fcc9722baf",
    "company_id": "tsn",
    "source_id": "ee036-fresh-09-tsn",
    "source_hash": "0cd48e98cf6747eb56060a9e76d9650ee3bb541569e8d5b89e7e3d8b1ff94694",
    "evidence_span": "Lori Bondar was appointed Senior Vice President and Chief Accounting Officer in December 2023",
    "evidence_start": 53,
    "evidence_end": 146,
    "subject": "Lori Bondar",
    "action_or_state": "was appointed",
    "object": "Senior Vice President and Chief Accounting Officer",
    "timing": "HISTORICAL",
    "polarity": "NEUTRAL",
    "scope": "corporate finance leadership",
    "entity_relationship": "ISSUER",
    "publication_date": "2025-11-10",
    "effective_date": null,
    "confidence": "HIGH",
    "decision": "ACCEPT",
    "reason_code": "DEVELOPMENT_REPLAY_YES",
    "extractor_version": "evidence-engine-v0.3.7-development",
    "model_version": "ai-finops-review-replay-v1",
    "created_at": "2026-08-19T07:05:38.364725Z"
  },
  {
    "observation_id": "obs-037-23bc4bb18ffb8244f4f6",
    "company_id": "tsn",
    "source_id": "ee036-fresh-09-tsn",
    "source_hash": "0cd48e98cf6747eb56060a9e76d9650ee3bb541569e8d5b89e7e3d8b1ff94694",